datetime,author_title,review_text,review_rating
03/31/2023 18:01:13,Kim Carter,"We cannot say enough positive things about our customer experience with Sheila and First County Bank.  For the 8 years we have been working with them, Sheila has been welcoming, professional and available to assist us every time we walk through the door or call.  They care about their community and are sincerely interested in our agency and finding the best solution for our needs.  I highly recommend First County Bank, Sheila, and her Main Avenue team!
Kim Carter, Development Officer
Keystone House, Inc.",5
03/17/2023 02:10:29,Evelyne Waldemar,"I called the branch to get information on HELC loan and Sheila took her time to explain the whole process and educated me about the product  . She helped me in the past with different products and is very knowledgeable and transparent.
I would recommend her for any lending , insurance and banking needs .",5
03/22/2023 21:07:21,Jennifer Beltran,"I stopped in at the Main Ave location recently , since I was thinking of opening an account and Sheila the branch manager was super helpful with giving me all the information I needed. Sheila is amazing , she is super welcoming. Thank you Sheila!",5
05/06/2022 18:02:02,Louis Guarnieri,"I have been a customer at this bank/branch since it’s opening 18 years ago.  Diego is always very helpful in my daily banking.  Recently I added an account and had to make adjustments to others.  Sheila, the branch manager was indispensable in answering many questions, resolving concerns and getting all new and existing accounts in proper order.",5
03/08/2023 18:35:11,Natasha Weglarz,"The team at the Main Avenue branch are all great. Sheila, the branch manager is an absolute gem! She is affable, professional and always provides impeccable service whenever I visit or call the branch.",5
04/05/2022 17:55:18,Maralyne Zuniga,"Beyond satisfied! Came in for the first time to open an account a gentlemen by the name of Diego was beyond helpful, patient, and friendly! Made the process so easy and made sure I knew my options and what would be good for me. An excellent job and amazing customer service !",5
06/18/2021 13:05:00,gina royal,"This is one the best banks I have banked with. You can truly tell that they care for their customers needs. One associate specifically that made my experience with this bank great ,was Sheila. She truly listened to my concerns and wants and helped me get exactly what I needed. Would 10/10 recommend this bank to anyone .",5
05/12/2022 19:19:04,Chris Frederick,"Where do I start? At first I had nothing good to say about this bank, I traveled to Connecticut this past weekend the D.C. area to be placed on an account of a close relative. Mine you I took train up and back just to handle this important affair for my relative. Today after receiving an email from the bank, I attempted to setup the online banking but was unable to do so. After contacting customer service I was meet, rudeness, someone not listening to what I said and just some of the worst customer service I have ever experienced.  After asking to speak with the representatives supervisor I was transferred to Sheila at the Norwalk branch.  I have nothing but kind words for her, she took the time to listen to my concerns and the issues that I was having setting up the online account. This type of customer service is lacking in today's society, Shelia called me back within 3 mins and stayed on the phone with me until I was able to sign in. She then took the time to explain to me how to access the pay my bills and apologized for the rudeness I had experienced. I thanked her for her assistance and felt the need to let First County Bank know what a Great employee they have in Sheila. If I lived in the area they would be gaining a  new customer and  because of her it is the only reason I have not asked my relative to consider changing to different financial institution.",4
04/11/2022 15:40:43,sandy teixeira,Great experience with the branch manager Sheila! She was very knowledgeable and able to answer all the questions we had! Looking forward to our future business together.,5
04/07/2022 15:55:43,Renee Joseph,I love FCB.  Sheila Content is always polite and always has a smile to brighten my day.  The other bankers are friendly as well and willing to help.,5
04/13/2023 15:19:10,Karen Corcoran,I always Seem like I need extra assistance.The people at 1st county always oblige with a smile on their face. Very easy to deal with and very friendly as well.,5
05/17/2022 19:21:12,Blaine Booker,"Today I was at the Danbury Road branch, and my teller was Andrea. She did a great job informing me of what products were available to me as well as helping me with my transaction today. Thank you Andrea!",5
04/12/2022 22:02:33,Carmen Montalvan,"I have been a First County bank  customer for many years and i have always had a good experience with the tellers.. I recently went in to try to refinance but the mortgage person was not that professional so i decided not to go forward with it... So I went back for my paper work and met Sheila the manager was very helpful and understanding, Sofia and the rest of the staff are always so welcoming.",4
03/01/2018 18:33:16,Sonia A.,First county bank has been my bank since 1999. I am glad that Elizabeth Brucker is now part of first county bank. She is great and very professional.  I know Elizabeth since2008 when I bought my first home. And in 2013 my second home. She is part of our family helping us go through the horrifying paperwork process of buying a property.,5
03/23/2023 14:09:07,Emmanuella Lauture,Banking at FCB has been so easy because everyone is attentive and kind. I would highly recommend banking at FCB for your personal and/or business needs.,5
03/16/2023 19:31:48,IL Posto Management,"Extremely Pleased with the connections I've made through FCB, this branch in particularly has given the personal attention small businesses need nowadays.",5
03/22/2023 21:24:07,Danielle Regimbal,Thought about changing banks to someplace close by. Spoke with Sheila the Branch Manager who was very knowledgeable and offered me a lot of great information.,5
03/16/2023 19:31:18,Adian Pryce,"I was taken care of immediately.
And she was nice happy and polite .
This why I love fist county bank",5
03/16/2023 13:13:23,Brandmans Equipment,"Very informative, helpful, professional and easy to deal with,  responded in a timely manner. Great customer service!",5
04/05/2022 22:19:50,Katie Payes,"Had a few question regarding student loans and got help from staff member named Diego, he was very helpful and patient.",5
06/24/2021 18:28:29,beth,Have been banking with this particular branch for years - always professional and always very personable. I appreciate them very much.,5
04/12/2022 00:31:34,Maysan Duncan,"I really like this branch, Especially the Branch Manager. She is very nice and helpful.",5
12/04/2021 02:34:06,Sam Paolini,Great customer service!  Big thank you to Sheila and the entire staff!,5
03/18/2023 14:59:47,Joseph Ruggiero,"Very friendly, professional and helpful staff",5
06/16/2022 18:39:12,Steve Crouse,"Always helpful,  any branch.........better then the mega banks.",5
03/14/2023 17:14:45,Maria Camomilli,"Excellent customer service
By Diego Gomez",5
12/26/2012 13:52:10,good anti,"Skip this bank.
Too small to care about customers.
Dont even think about getting a CC from them.",2
06/18/2021 19:01:47,Guy Philippe,Great customer service. Very professional,5
10/12/2023 13:00:06,Michael Behnam,Amazing service,5
06/17/2021 18:57:31,Naomie Bousseau,Great service!,5
07/25/2012 21:57:39,Tanya,The worst bank!,2
06/07/2021 15:10:46,John Barricelli,Great service,5
06/18/2021 01:33:21,Benita Joseph,,5
05/06/2022 15:32:27,Liz Daher,,5
10/22/2021 18:06:58,Mimi Shilleh,,5
04/06/2022 19:51:42,Natalia Aristizabal,,5
